[
  {
    "schema_version": "1.0.0",
    "shot_id": "EP001-SH001",
    "scene_id": "EP001-SC001",
    "story_purpose": "三秒内建立主角即将被抄斩的死局",
    "duration_s": 3,
    "start_boundary": "萧策跪在青灰石地，双手空闲，沈岳站立，圣旨在沈岳手中",
    "primary_transition": "沈岳把圣旨掷到萧策面前",
    "end_boundary": "圣旨停在萧策膝前，萧策抬眼，沈岳俯视",
    "camera": {"shot_size": "low medium", "movement": "fast downward tilt then lock", "screen_direction": "沈岳画面左，萧策画面右"},
    "references": [],
    "continuity_locks": ["CH001@1", "CH002@1", "LC001@1", "PR002@sealed"]
  },
  {
    "schema_version": "1.0.0",
    "shot_id": "EP001-SH002",
    "scene_id": "EP001-SC001",
    "story_purpose": "表现穿越苏醒和能力上线",
    "duration_s": 3,
    "start_boundary": "萧策低头跪地，神情恍惚",
    "primary_transition": "他短暂看见现代审计会议白光并迅速聚焦沈岳袖口账册",
    "end_boundary": "萧策目光锐利锁定账册",
    "camera": {"shot_size": "extreme close-up", "movement": "micro push-in", "screen_direction": "正轴"},
    "references": [],
    "continuity_locks": ["CH001@1", "CH002@1", "PR001@closed"]
  },
  {
    "schema_version": "1.0.0",
    "shot_id": "EP001-SH003",
    "scene_id": "EP001-SC001",
    "story_purpose": "第一次反击，用不可能运粮时间击穿权臣气势",
    "duration_s": 5,
    "start_boundary": "沈岳仍俯视，萧策跪着但腰背挺直",
    "primary_transition": "萧策抬头质问粮车速度，沈岳笑意凝固",
    "end_boundary": "两人对视，权力关系首次松动",
    "camera": {"shot_size": "shot reverse shot", "movement": "locked with subtle push", "screen_direction": "保持左右轴线"},
    "references": [],
    "continuity_locks": ["CH001@1", "CH002@1", "LC001@1"]
  },
  {
    "schema_version": "1.0.0",
    "shot_id": "EP001-SH004",
    "scene_id": "EP001-SC001",
    "story_purpose": "把抽象审计能力变成可见证据",
    "duration_s": 5,
    "start_boundary": "账册仍在沈岳袖口，萧策右手空闲",
    "primary_transition": "萧策夺过并快速翻到账册封底，把两道印痕并置",
    "end_boundary": "账册封底占据画面，双重印痕清楚但无可读文字",
    "camera": {"shot_size": "hand insert to macro", "movement": "whip follow then lock", "screen_direction": "右手动作由右向左"},
    "references": [],
    "continuity_locks": ["CH001@1", "CH002@1", "PR001@open-seal"]
  },
  {
    "schema_version": "1.0.0",
    "shot_id": "EP001-SH005",
    "scene_id": "EP001-SC001",
    "story_purpose": "公开宣判假账，让权臣失去控制",
    "duration_s": 5,
    "start_boundary": "萧策右手持账，沈岳站立",
    "primary_transition": "萧策指出重复税号和缺失龙爪，沈岳下意识摸左手玉扳指",
    "end_boundary": "沈岳眼神动摇，左手仍停在扳指上",
    "camera": {"shot_size": "medium two-shot", "movement": "slow lateral slide", "screen_direction": "保持沈左萧右"},
    "references": [],
    "continuity_locks": ["CH001@1", "CH002@1", "PR001@open-seal", "CH002:left-hand-ring"]
  },
  {
    "schema_version": "1.0.0",
    "shot_id": "EP001-SH006",
    "scene_id": "EP001-SC001",
    "story_purpose": "权威核验证据并制造死寂",
    "duration_s": 4,
    "start_boundary": "内侍从萧策手中接到账册",
    "primary_transition": "内侍核对印痕后抬头，殿上众人静止",
    "end_boundary": "内侍面向御座轻微点头，沈岳脸色苍白",
    "camera": {"shot_size": "medium wide", "movement": "slow dolly back", "screen_direction": "轴线不变"},
    "references": [],
    "continuity_locks": ["CH001@1", "CH002@1", "LC001@1", "PR001@verified"]
  },
  {
    "schema_version": "1.0.0",
    "shot_id": "EP001-SH007",
    "scene_id": "EP001-SC001",
    "story_purpose": "完成身份翻转，权臣跪倒",
    "duration_s": 5,
    "start_boundary": "沈岳仍站立，禁军位于远处背景",
    "primary_transition": "画外皇帝下令查沈府，沈岳双膝坠地，禁军从后合拢",
    "end_boundary": "沈岳跪地，萧策在背景缓慢站起",
    "camera": {"shot_size": "low wide", "movement": "slow rise with 萧策", "screen_direction": "沈岳居前左，萧策后右"},
    "references": [],
    "continuity_locks": ["CH001@1", "CH002@1", "LC001@1", "CH002:left-hand-ring"]
  },
  {
    "schema_version": "1.0.0",
    "shot_id": "EP001-SH008",
    "scene_id": "EP001-SC001",
    "story_purpose": "兑现标题级打脸台词",
    "duration_s": 5,
    "start_boundary": "萧策站立，圣旨在地上，沈岳跪地",
    "primary_transition": "萧策用鞋尖把圣旨推回沈岳膝前并俯视他说抄错了人",
    "end_boundary": "圣旨贴在沈岳膝前，萧策稳定站立",
    "camera": {"shot_size": "low two-shot", "movement": "short push-in", "screen_direction": "圣旨由右向左滑动"},
    "references": [],
    "continuity_locks": ["CH001@1", "CH002@1", "PR002@sealed"]
  },
  {
    "schema_version": "1.0.0",
    "shot_id": "EP001-SH009",
    "scene_id": "EP001-SC001",
    "story_purpose": "用更大幕后势力制造追更钩子",
    "duration_s": 4,
    "start_boundary": "沈岳被拖离，账册留在萧策手中",
    "primary_transition": "萧策掀开夹层，凤纹私印滑入掌心",
    "end_boundary": "凤纹私印微距定格，萧策眼神映在旧墨反光中",
    "camera": {"shot_size": "macro insert", "movement": "rack focus from seal to eye reflection", "screen_direction": "正轴"},
    "references": [],
    "continuity_locks": ["CH001@1", "PR001@hidden-compartment", "PR003@revealed"]
  },
  {
    "schema_version": "1.0.0",
    "shot_id": "EP001-SH010",
    "scene_id": "EP001-SC001",
    "story_purpose": "留出字幕和下一集钩子的稳定结尾",
    "duration_s": 3,
    "start_boundary": "凤纹私印位于萧策掌心",
    "primary_transition": "环境暗下，仅保留印章轮廓和萧策半张脸",
    "end_boundary": "画面稳定无残余动作，可安全切黑",
    "camera": {"shot_size": "close-up", "movement": "locked", "screen_direction": "正轴"},
    "references": [],
    "continuity_locks": ["CH001@1", "PR003@revealed"]
  }
]
